{
  "protocol_version": "codeattest.v0",
  "review_id": "review:synthetic-demo-001",
  "validation_script_id": "validation_script:synthetic_included_003",
  "validation_path_ref": "validation_path:synthetic_script_001",
  "classification_record_ref": "classification_record:synthetic_requires_validation_001",
  "remediation_guidance_ref": "remediation_guidance:synthetic_requires_path_only_001",
  "script_package_status": "included_base_package",
  "included_script_slot": 3,
  "purpose": "SYNTHETIC_DEMO_DATA confirm a third bounded synthetic runtime condition in the customer environment. NOT_CUSTOMER_SOURCE.",
  "prerequisites": "SYNTHETIC_DEMO_DATA run from the selected application test shell with fixture data only. NOT_CUSTOMER_SOURCE.",
  "execution_steps": "SYNTHETIC_DEMO_DATA execute node ./scripts/synthetic-validation-three.mjs and capture retained output. NOT_CUSTOMER_SOURCE.",
  "expected_output": "SYNTHETIC_DEMO_DATA command prints validation evidence reference for the third included script. NOT_CUSTOMER_SOURCE.",
  "safety_notes": "SYNTHETIC_DEMO_DATA script remains read-only and does not contact unauthorized targets. NOT_CUSTOMER_SOURCE.",
  "output_attachment_instructions": "SYNTHETIC_DEMO_DATA attach output as customer-provided validation evidence for Epic 4. NOT_CUSTOMER_SOURCE.",
  "script_content": "#!/usr/bin/env node\nconsole.log('SYNTHETIC_DEMO_DATA third validation output NOT_CUSTOMER_SOURCE');",
  "authored_at": "2026-07-28T00:07:00Z",
  "actor": {
    "actor_type": "reviewer",
    "actor_id": "reviewer:synthetic-amelia"
  },
  "source_derived_class": "retained_review_artifact",
  "visibility": "customer_facing"
}
